{"claim_label":"survival-stress","profile_invariant":{"bars":6,"egress_blocked_count":0,"gate_blocks":0,"invalid_actions":1,"kill_switch_fired":false,"liquidated":true,"missed_decisions":2,"post_kill_switch_attempts":0,"survival_verdict":"liquidated","turns":5},"profiles":{"primary":{"cvar5_1e8":-79734454,"dist_to_liq_median_1e8":27819539,"dist_to_liq_min_1e8":27529074,"dist_to_liq_p05_1e8":27674598,"dist_to_liq_p25_1e8":27674598,"equity_curve_ref":"ledger.jsonl","fees_paid_micro":-10355175,"fill_cost_micro":-11500000,"funding_paid_micro":-2863500,"max_drawdown_1e8":79967181,"net_return_1e8":-79965187,"sortino_1e8":-45360460,"turnover_1e8":381915000},"stress_2x":{"cvar5_1e8":-79911196,"dist_to_liq_median_1e8":27783466,"dist_to_liq_min_1e8":27492857,"dist_to_liq_p05_1e8":27638453,"dist_to_liq_p25_1e8":27638453,"equity_curve_ref":"ledger_stress_2x.jsonl","fees_paid_micro":-20720700,"fill_cost_micro":-23000000,"funding_paid_micro":-2863500,"max_drawdown_1e8":80183842,"net_return_1e8":-80183842,"sortino_1e8":-45482557,"turnover_1e8":382030000}},"run_id":"run_00000000000000b1","schema":"metrics/v1"}
