{"claim_label":"survival-stress","profile_invariant":{"bars":14,"egress_blocked_count":0,"gate_blocks":2,"invalid_actions":1,"kill_switch_fired":false,"liquidated":false,"missed_decisions":6,"post_kill_switch_attempts":0,"survival_verdict":"survived","turns":13},"profiles":{"primary":{"cvar5_1e8":-10730811,"dist_to_liq_median_1e8":40029870,"dist_to_liq_min_1e8":3307248,"dist_to_liq_p05_1e8":24172526,"dist_to_liq_p25_1e8":27674598,"equity_curve_ref":"ledger.jsonl","fees_paid_micro":-31975200,"fill_cost_micro":-35527780,"funding_paid_micro":-30991730,"max_drawdown_1e8":11755971,"net_return_1e8":-9709348,"sortino_1e8":-24562045,"turnover_1e8":710559962},"stress_2x":{"cvar5_1e8":-10754598,"dist_to_liq_median_1e8":39999900,"dist_to_liq_min_1e8":3258926,"dist_to_liq_p05_1e8":24134631,"dist_to_liq_p25_1e8":27638453,"equity_curve_ref":"ledger_stress_2x.jsonl","fees_paid_micro":-63850027,"fill_cost_micro":-70943600,"funding_paid_micro":-30928205,"max_drawdown_1e8":12080106,"net_return_1e8":-10390019,"sortino_1e8":-26392481,"turnover_1e8":709444732}},"run_id":"run_00000000000000a1","schema":"metrics/v1"}
